code,title,type
DAT316,Analyze blockchain data with Amazon Bedrock AgentCore,Builders' session
DAT457,Autonomous Web3 agents on AWS,Code talk
GBL302,Beyond Fine-Tuning: Agentic AI for HFT Quantitative Analytics ,Lightning talk
DAT448,Build a stablecoin payment processor using AWS serverless services,Workshop
DAT454,Deploy and manage blockchain nodes on AWS,Chalk talk
DAT317,Microseconds matter: Architect ultra-low latency trading platforms,Chalk talk
IND3301,"Ripple: Building an intelligent, multi-agent system for 24/7 operations",Breakout session
DAT318,Web3 + AI: Agents that mean business,Breakout session
