code,title,type
ARC403,Building adaptive AI agents: Enterprise patterns that scale,Workshop
SEC304,Building an AI-Powered security guardian for your Cognito applications,Chalk talk
ISV402, Building Customizable AI Agents: A Fast-Track Guide for ISVs,Builders' session
IND345,Building privacy-aware generative AI applications in financial services,Chalk talk
SEC307,"Design authentication, authorization, and logging logic in Agentic AI apps",Workshop
SEC339,Modern workload identity management strategies,Chalk talk
SEC406,Red teaming your generative AI and MCP applications at scale,Workshop
SEC312,Secure and build apps in minutes with Amazon Verified Permissions,Builders' session
SEC328-S,Securing AI Agents: The Future of Identity & Access Control (sponsored by WorkOS),Breakout session
